slide_number,header_small,header_large,body_text,footer_text,icon
1,BLKOUT IS RECRUITING,JOIN OUR BOARD,5 positions. Your community. Our future.,blkoutuk.com/governance,🏛️
2,COMMUNITY BENEFIT SOCIETY,We're building something extraordinary.,BLKOUT is now a registered Community Benefit Society. We need leaders to guide us home.,10 years of community. Now it's time for governance.,✨
3,5 POSITIONS AVAILABLE,Chair,Lead our governance with vision,💷 Treasurer · 📋 Secretary · 💻 Tech Director · 🤝 Community Director,🪑
4,WHO WE'RE LOOKING FOR,You. Beloved.,Black queer men who care deeply. Bring lived experience (that's enough). Can commit 4-6 hours monthly.,Heart for the work? Essential. Formal qualifications? Optional.,💜
5,KEY DATES,February 14,EOI Deadline,Feb 15-16: Info Session on BLKOUTHUB · TBA: Board Elections at AGM,📅
6,THE REVOLUTION NEEDS GOVERNANCE,APPLY NOW,blkoutuk.com/governance,Join or reactivate your BLKOUTHUB membership first,👉
